{
  "clauses": [
    {
      "end": 315,
      "id": "r001-c001",
      "instruction_sha256": "f3ec3da73b5c6e86c91ab93f4e67958376fcf0ea3994e0c93133c62a5e6c7497",
      "kind": "normative",
      "requirement_ids": [
        "req-r001-001",
        "req-r001-042"
      ],
      "source_round": 1,
      "start": 0,
      "text": "Build a deterministic data pipeline tool in Go called `dpipe`. The tool operates as a CLI that reads structured data from CSV files, applies a chain of transformations, and writes results to output files — with every step producing bit-identical output across repeated runs given the same input and configuration.\n\n"
    },
    {
      "end": 334,
      "id": "r001-c002",
      "instruction_sha256": "f3ec3da73b5c6e86c91ab93f4e67958376fcf0ea3994e0c93133c62a5e6c7497",
      "kind": "context",
      "requirement_ids": [],
      "source_round": 1,
      "start": 315,
      "text": "## Core behaviors\n\n"
    },
    {
      "end": 349,
      "id": "r001-c003",
      "instruction_sha256": "f3ec3da73b5c6e86c91ab93f4e67958376fcf0ea3994e0c93133c62a5e6c7497",
      "kind": "context",
      "requirement_ids": [],
      "source_round": 1,
      "start": 334,
      "text": "### Ingestion\n\n"
    },
    {
      "end": 412,
      "id": "r001-c004",
      "instruction_sha256": "f3ec3da73b5c6e86c91ab93f4e67958376fcf0ea3994e0c93133c62a5e6c7497",
      "kind": "normative",
      "requirement_ids": [
        "req-r001-002"
      ],
      "source_round": 1,
      "start": 349,
      "text": "`dpipe ingest --input <path> --schema <path> --output <path>`\n\n"
    },
    {
      "end": 1005,
      "id": "r001-c005",
      "instruction_sha256": "f3ec3da73b5c6e86c91ab93f4e67958376fcf0ea3994e0c93133c62a5e6c7497",
      "kind": "normative",
      "requirement_ids": [
        "req-r001-003"
      ],
      "source_round": 1,
      "start": 412,
      "text": "- Reads a CSV file at `<path>`. The first row is a header.\n- Validates every row against a JSON schema file. The schema has this structure:\n  ```json\n  {\n    \"columns\": [\n      {\"name\": \"id\", \"type\": \"int\", \"required\": true, \"unique\": true},\n      {\"name\": \"value\", \"type\": \"float\", \"required\": true, \"min\": 0, \"max\": 1000},\n      {\"name\": \"label\", \"type\": \"string\", \"required\": false, \"pattern\": \"^[A-Z]\"},\n      {\"name\": \"timestamp\", \"type\": \"datetime\", \"required\": true}\n    ],\n    \"primary_key\": [\"id\"]\n  }\n  ```\n  Supported types: `int`, `float`, `string`, `datetime` (RFC 3339 format).\n\n"
    },
    {
      "end": 1665,
      "id": "r001-c006",
      "instruction_sha256": "f3ec3da73b5c6e86c91ab93f4e67958376fcf0ea3994e0c93133c62a5e6c7497",
      "kind": "normative",
      "requirement_ids": [
        "req-r001-004"
      ],
      "source_round": 1,
      "start": 1005,
      "text": "  Column constraints (all optional):\n  - `unique` (boolean): No two valid rows may have the same value in this column. When a duplicate is encountered (checked in input file order after all other validations pass), the later row is rejected with reason `duplicate value for unique column: <name>`.\n  - `min`, `max` (number): For `int` and `float` columns only. Value must be within `[min, max]` inclusive. Rejected rows get reason `value out of range for column <name>: <value>`.\n  - `pattern` (string): For `string` columns only. Value must match the Go regular expression. Rejected rows get reason `value does not match pattern for column <name>: <value>`.\n\n"
    },
    {
      "end": 1922,
      "id": "r001-c007",
      "instruction_sha256": "f3ec3da73b5c6e86c91ab93f4e67958376fcf0ea3994e0c93133c62a5e6c7497",
      "kind": "normative",
      "requirement_ids": [
        "req-r001-005"
      ],
      "source_round": 1,
      "start": 1665,
      "text": "  Validation order for each row: (1) required/type checks, (2) range checks, (3) pattern checks. After all rows pass steps 1-3, uniqueness is checked across valid rows in input file order — the first occurrence is kept, subsequent duplicates are rejected.\n\n"
    },
    {
      "end": 2011,
      "id": "r001-c008",
      "instruction_sha256": "f3ec3da73b5c6e86c91ab93f4e67958376fcf0ea3994e0c93133c62a5e6c7497",
      "kind": "normative",
      "requirement_ids": [
        "req-r001-006"
      ],
      "source_round": 1,
      "start": 1922,
      "text": "  `primary_key` is always an array of one or more column names (composite key support).\n\n"
    },
    {
      "end": 2623,
      "id": "r001-c009",
      "instruction_sha256": "f3ec3da73b5c6e86c91ab93f4e67958376fcf0ea3994e0c93133c62a5e6c7497",
      "kind": "normative",
      "requirement_ids": [
        "req-r001-007",
        "req-r001-008",
        "req-r001-009"
      ],
      "source_round": 1,
      "start": 2011,
      "text": "- Rows that fail validation are written to `<output>.rejected` (same CSV format, with an appended `rejection_reason` column). Valid rows are written to `<output>` in CSV format.\n- Output rows are sorted by the primary key columns in declaration order: first by the first primary key column, then by the second, etc. Each column is sorted in ascending order using its declared type (numeric sort for int/float, lexicographic for string, chronological for datetime).\n- A SHA-256 checksum of the output file (computed on the raw bytes) is written to `<output>.sha256` as a single hex string followed by a newline.\n\n"
    },
    {
      "end": 2643,
      "id": "r001-c010",
      "instruction_sha256": "f3ec3da73b5c6e86c91ab93f4e67958376fcf0ea3994e0c93133c62a5e6c7497",
      "kind": "context",
      "requirement_ids": [],
      "source_round": 1,
      "start": 2623,
      "text": "### Transformation\n\n"
    },
    {
      "end": 2725,
      "id": "r001-c011",
      "instruction_sha256": "f3ec3da73b5c6e86c91ab93f4e67958376fcf0ea3994e0c93133c62a5e6c7497",
      "kind": "normative",
      "requirement_ids": [
        "req-r001-010"
      ],
      "source_round": 1,
      "start": 2643,
      "text": "`dpipe transform --input <path> --recipe <path> --output <path> --seed <uint64>`\n\n"
    },
    {
      "end": 4337,
      "id": "r001-c012",
      "instruction_sha256": "f3ec3da73b5c6e86c91ab93f4e67958376fcf0ea3994e0c93133c62a5e6c7497",
      "kind": "normative",
      "requirement_ids": [
        "req-r001-011",
        "req-r001-012",
        "req-r001-013"
      ],
      "source_round": 1,
      "start": 2725,
      "text": "- Reads a CSV file with a header row. In typical usage this will be a previously ingested (valid) CSV file, but any headered CSV input is allowed.\n- Applies transformations defined in a JSON recipe file, in order. Each transformation is an object in an array:\n  ```json\n  [\n    {\"op\": \"filter\", \"column\": \"value\", \"condition\": \"gt\", \"threshold\": 10.0},\n    {\"op\": \"derive\", \"name\": \"score\", \"expression\": \"value * 2 + 1\"},\n    {\"op\": \"sample\", \"fraction\": 0.5},\n    {\"op\": \"sort\", \"column\": \"score\", \"order\": \"desc\"},\n    {\"op\": \"rename\", \"from\": \"label\", \"to\": \"category\"},\n    {\"op\": \"drop\", \"columns\": [\"timestamp\"]},\n    {\"op\": \"aggregate\", \"group_by\": [\"label\"], \"aggregations\": [\n      {\"column\": \"value\", \"function\": \"sum\", \"as\": \"total_value\"},\n      {\"column\": \"value\", \"function\": \"avg\", \"as\": \"avg_value\"},\n      {\"column\": \"id\", \"function\": \"count\", \"as\": \"num_items\"}\n    ]},\n    {\"op\": \"join\", \"right\": \"other.csv\", \"on\": \"id\", \"type\": \"left\"},\n    {\"op\": \"window\", \"function\": \"rank\", \"partition_by\": [\"label\"], \"order_by\": [{\"column\": \"value\", \"order\": \"desc\"}], \"as\": \"value_rank\"},\n    {\"op\": \"pivot\", \"index\": [\"id\"], \"column\": \"label\", \"value\": \"value\"},\n    {\"op\": \"unpivot\", \"index\": [\"id\"], \"columns\": [\"q1\", \"q2\", \"q3\"], \"name_to\": \"quarter\", \"value_to\": \"amount\"},\n    {\"op\": \"fill\", \"columns\": [\"value\"], \"strategy\": \"forward\"}\n  ]\n  ```\n- Supported operations:\n  - `filter`: Keep rows where `column` satisfies `condition` against `threshold`. Conditions: `gt`, `gte`, `lt`, `lte`, `eq`, `neq`.\n  - `derive`: Add a new column computed from an expression over existing numeric columns.\n\n"
    },
    {
      "end": 4905,
      "id": "r001-c013",
      "instruction_sha256": "f3ec3da73b5c6e86c91ab93f4e67958376fcf0ea3994e0c93133c62a5e6c7497",
      "kind": "normative",
      "requirement_ids": [
        "req-r001-014"
      ],
      "source_round": 1,
      "start": 4337,
      "text": "    **Operator precedence** (lowest to highest):\n    1. `||` (logical OR): returns `1` if either operand is > 0, otherwise `0`\n    2. `&&` (logical AND): returns `1` if both operands are > 0, otherwise `0`\n    3. `==`, `!=` (equality): numeric comparison, returns `1` (true) or `0` (false)\n    4. `>`, `>=`, `<`, `<=` (relational): numeric comparison, returns `1` or `0`\n    5. `+`, `-` (addition, subtraction)\n    6. `*`, `/`, `%` (multiplication, division, modulo)\n    7. Unary `-` (negation)\n    8. Function calls, parentheses, column references, numeric literals\n\n"
    },
    {
      "end": 5036,
      "id": "r001-c014",
      "instruction_sha256": "f3ec3da73b5c6e86c91ab93f4e67958376fcf0ea3994e0c93133c62a5e6c7497",
      "kind": "normative",
      "requirement_ids": [
        "req-r001-015"
      ],
      "source_round": 1,
      "start": 4905,
      "text": "    Division by zero produces `NaN`. Modulo by zero produces `NaN`. Any comparison involving `NaN` (on either side) produces `0`.\n\n"
    },
    {
      "end": 5848,
      "id": "r001-c015",
      "instruction_sha256": "f3ec3da73b5c6e86c91ab93f4e67958376fcf0ea3994e0c93133c62a5e6c7497",
      "kind": "normative",
      "requirement_ids": [
        "req-r001-016"
      ],
      "source_round": 1,
      "start": 5036,